0,1-1A1,E1,A,1,What is a requirement of all marine transmitting apparatus used aboard United States vessels?,Only equipment that has been certified by the FCC for Part 80 operations is authorized.,Equipment must be type-accepted by the U.S. Coast Guard for maritime mobile use.,Certification is required by the International Maritime Organization (IMO).,Programming of all maritime channels must be performed by a licensed Marine Radio Operator.,A,00,1-1A2,E1,A,1,What transmitting equipment is authorized for use by a station in the maritime services?,Transmitters that have been certified by the manufacturer for maritime use.,"Unless specifically excepted, only transmitters certified by the Federal Communications Commission for Part 80 operations.",Equipment that has been inspected and approved by the U.S. Coast Guard.,Transceivers and transmitters that meet all ITU specifications for use in maritime mobile service.,B,00,1-1A3,E1,A,1,Small passenger vessels that sail 20 to 150 nautical miles from the nearest land must have what additional equipment?,Inmarsat-B terminal.,Inmarsat-C terminal.,Aircraft Transceiver with 121.5 MHz.,MF-HF SSB Transceiver.,D,00,1-1A4,E1,A,1,What equipment is programmed to initiate transmission of distress alerts and calls to individual stations?,NAVTEX.,GPS.,DSC controller.,Scanning Watch Receiver.,C,00,1-1A5,E1,A,1,What is the minimum transmitter power level required by the FCC for a medium-frequency transmitter aboard a compulsorily fitted vessel?,"At least 100 watts, single-sideband, suppressed-carrier power.",At least 60 watts PEP.,The power predictably needed to communicate with the nearest public coast station operating on 2182 kHz.,At least 25 watts delivered into 50 ohms effective resistance when operated with a primary voltage of 13.6 volts DC.,B,00,1-1A6,E1,A,1,Shipboard transmitters using F3E emission (FM voice) may not exceed what carrier power?,500 watts.,250 watts.,100 watts.,25 watts.,D,00,1-2A1,E1,A,2,Which commercial radio operator license is required to operate a fixed-tuned ship RADAR station with external controls?,A radio operator certificate containing a Ship RADAR Endorsement.,A Marine Radio Operator Permit or higher.,Either a First or Second Class Radiotelegraph certificate or a General Radiotelephone Operator License.,No radio operator authorization is required.,D,00,1-2A2,E1,A,2,When is a Marine Radio Operator Permit or higher license required for aircraft communications?,When operating on frequencies below 30 MHz allocated exclusively to aeronautical mobile services.,When operating on frequencies above 30 MHz allocated exclusively to aeronautical mobile services.,When operating on frequencies below 30 MHz not allocated exclusively to aeronautical mobile services.,When operating on frequencies above 30 MHz not assigned for international use.,C,00,1-2A3,E1,A,2,Which of the following persons are ineligible to be issued a commercial radio operator license?,Individuals who are unable to send and receive correctly by telephone spoken messages in English.,Handicapped persons with uncorrected disabilities which affect their ability to perform all duties required of commercial radio operators.,Foreign maritime radio operators unless they are certified by the International Maritime Organization (IMO).,U.S. Military radio operators who are still on active duty.,A,00,1-2A4,E1,A,2,What are the radio operator requirements of a passenger ship equipped with a GMDSS installation?,The operator must hold a General Radiotelephone Operator License or higher-class license.,The operator must hold a Restricted Radiotelephone Operator Permit or higher-class license.,The operator must hold a Marine Radio Operator Permit or higher-class license.,"Two operators on board must hold a GMDSS Radio Operator License or a Restricted GMDSS Radio Operator License, depending on the ship's operating areas.",D,00,1-2A5,E1,A,2,What is the minimum radio operator requirement for ships subject to the Great Lakes Radio Agreement?,Third Class Radiotelegraph Operator's Certificate.,General Radiotelephone Operator License.,Marine Radio Operator Permit.,Restricted Radiotelephone Operator Permit.,C,00,1-2A6,E1,A,2,What is a requirement of every commercial operator on duty and in charge of a transmitting system?,A copy of the Proof-of-Passing Certificate (PPC) must be in the station's records.,The original license or a photocopy must be posted or in the operator's personal possession and available for inspection.,The FCC Form 605 certifying the operator's qualifications must be readily available at the transmitting system site.,A copy of the operator's license must be supplied to the radio station's supervisor as evidence of technical qualification.,B,00,1-3A1,E1,A,3,Radio watches for compulsory radiotelephone stations will include the following:,VHF channel 22a continuous watch at sea.,121.5 MHz continuous watch at sea.,VHF channel 16 continuous watch.,500 kHz.,C,00,1-3A2,E1,A,3,"All compulsory equipped cargo ships (except those operating under GMDSS regulations or in a VTS) while being navigated outside of a harbor or port, shall keep a continuous radiotelephone watch on:",2182 kHz and Ch-16.,2182 kHz.,Ch-16.,Cargo ships are exempt from radio watch regulations.,A,00,1-3A3,E1,A,3,"What channel must all compulsory, non-GMDSS vessels monitor at all times in the open sea?",Channel 8.,Channel 70.,Channel 6.,Channel 16.,D,00,1-3A4,E1,A,3,"When a watch is required on 2182 kHz, at how many minutes past the hour must a 3 minute silent period be observed?","00, 30.","15, 45.","10, 40.","05, 35.",A,00,1-3A5,E1,A,3,Which is true concerning a required watch on VHF Ch-16?,"It is compulsory at all times while at sea until further notice, unless the vessel is in a VTS system.","When a vessel is in an A1 sea area and subject to the Bridge-to-Bridge act and in a VTS system, a watch is not required on Ch-16, provided the vessel monitors both Ch-13 and VTS channel.","It is always compulsory in sea areas A2, A3 and A4.",All of the above.,D,00,1-3A6,E1,A,3,What are the mandatory DSC watchkeeping bands/channels?,"VHF Ch-70, 2 MHz MF DSC, 6 MHz DSC and 1 other HF DSC.","8 MHz HF DSC, 1 other HF DSC, 2 MHz MF DSC and VHF Ch-70.","2 MHz MF DSC, 8 MHz DSC, VHF Ch-16 and 1 other HF DSC.",None of the above.,B,00,1-4A1,E1,A,4,Who is required to make entries in a required service or maintenance log?,The licensed operator or a person whom he or she designates.,The operator responsible for the station operation or maintenance.,Any commercial radio operator holding at least a Restricted Radiotelephone Operator Permit.,The technician who actually makes the adjustments to the equipment.,B,00,1-4A2,E1,A,4,Who is responsible for the proper maintenance of station logs?,The station licensee.,The commercially-licensed radio operator in charge of the station.,The ship's master and the station licensee.,The station licensee and the radio operator in charge of the station.,D,00,1-4A3,E1,A,4,Where must ship station logs be kept during a voyage?,At the principal radiotelephone operating position.,They must be secured in the vessel's strongbox for safekeeping.,In the personal custody of the licensed commercial radio operator.,All logs are turned over to the ship's master when the radio operator goes off duty.,A,00,1-4A4,E1,A,4,What is the proper procedure for making a correction in the station log?,"The ship's master must be notified, approve and initial all changes to the station log.",The mistake may be erased and the correction made and initialized only by the radio operator making the original error.,"The original person making the entry must strike out the error, initial the correction and indicate the date of the correction.",Rewrite the new entry in its entirety directly below the incorrect notation and initial the change.,C,00,1-4A5,E1,A,4,How long should station logs be retained when there are entries relating to distress or disaster situations?,Until authorized by the Commission in writing to destroy them.,"For a period of three years from the last date of entry, unless notified by the FCC.","Indefinitely, or until destruction is specifically authorized by the U.S. Coast Guard.",For a period of one year from the last date of entry.,B,00,1-4A6,E1,A,4,How long should station logs be retained when there are no entries relating to distress or disaster situations?,"For a period of three years from the last date of entry, unless notified by the FCC.",Until authorized by the Commission in writing to destroy them.,For a period of two years from the last date of entry.,"Indefinitely, or until destruction is specifically authorized by the U.S. Coast Guard.",C,00,1-5A1,E1,A,5,Radiotelephone stations required to keep logs of their transmissions must include:,"Station, date and time.",Name of operator on duty.,Station call signs with which communication took place.,All of these.,D,00,1-5A2,E1,A,5,Which of the following is true?,Battery test must be logged daily.,EPIRB tests are normally logged monthly.,Radiotelephone tests are normally logged weekly.,None of the above.,B,00,1-5A3,E1,A,5,Where should the GMDSS radio log be kept on board ship?,Captain's office.,Sea cabin.,At the GMDSS operating position.,Anywhere on board the vessel.,C,00,1-5A4,E1,A,5,Which of the following statements is true?,Key letters or abbreviations may be used in GMDSS Radio Logbooks if their meaning is noted in the log.,Key letters or abbreviations may not be used in GMDSS Radio Logbooks under any circumstances.,All Urgency communications must be entered in the logbook.,None of the above.,A,00,1-5A5,E1,A,5,Which of the following logkeeping statements is true?,"Entries relating to pre-voyage, pre-departure and daily tests are required.",Both a) and c),"A summary of all required Distress communications heard and Urgency communications affecting the station's own ship.  Also, all Safety communications (other than VHF) affecting the station's own ship must be logged.",Routine daily MF-HF and Inmarsat-C transmissions do not have to be logged.,B,00,1-5A6,E1,A,5,Which of the following statements concerning log entries is false?,All Safety communications received on VHF must be logged.,All required equipment tests must be logged.,The radio operator must log on and off watch.,The vessels daily position must be entered in the log.,A,00,1-6A1,E1,A,6,What regulations govern the use and operation of FCC-licensed ship stations in international waters?,The regulations of the International Maritime Organization (IMO) and Radio Officers Union.,Part 80 of the FCC Rules plus the international Radio Regulations and agreements to which the United States is a party.,The Maritime Mobile Directives of the International Telecommunication Union.,"Those of the FCC's Wireless Telecommunications Bureau, Maritime Mobile Service, Washington, DC 20554.",B,00,1-6A2,E1,A,6,When may the operator of a ship radio station allow an unlicensed person to speak over the transmitter?,At no time.  Only commercially-licensed radio operators may modulate the transmitting apparatus.,When the station power does not exceed 200 watts peak envelope power.,When under the supervision of the licensed operator.,During the hours that the radio officer is normally off duty.,C,00,1-6A3,E1,A,6,Where do you make an application for inspection of a ship GMDSS radio station?,To a Commercial Operator Licensing Examination Manager (COLE Manager).,"To the Federal Communications Commission, Washington, DC 20554.",To the Engineer-in-Charge of the FCC District Office nearest the proposed place of inspection.,To an FCC-licensed technician holding a GMDSS Radio Maintainer's License.,C,00,1-6A4,E1,A,6,Who has ultimate control of service at a ship's radio station?,The master of the ship.,A holder of a First Class Radiotelegraph Certificate with a six months' service endorsement.,The Radio Officer-in-Charge authorized by the captain of the vessel.,An appointed licensed radio operator who agrees to comply with all Radio Regulations in force.,A,00,1-6A5,E1,A,6,Where must the principal radiotelephone operating position be installed in a ship station?,At the principal radio operating position of the vessel.,"In the chart room, master's quarters or wheel house.",In the room or an adjoining room from which the ship is normally steered while at sea.,At the level of the main wheel house or at least one deck above the ship's main deck.,C,00,1-6A6,E1,A,6,"By international agreement, which ships must carry radio equipment for the safety of life at sea?",All ships traveling more than 100 miles out to sea.,Cargo ships of more than 100 gross tons and passenger vessels on international deep-sea voyages.,All cargo ships of more than 100 gross tons.,Cargo ships of more than 300 gross tons and vessels carrying more than 12 passengers.,D,00,1-7B1,E1,B,7,"What traffic management service is operated by the U.S. Coast Guard in certain designated water areas to prevent ship collisions, groundings and environmental harm?",Water Safety Management Bureau (WSMB).,Vessel Traffic Service (VTS).,Ship Movement and Safety Agency (SMSA).,Interdepartmental Harbor and Port Patrol (IHPP).,B,00,1-7B2,E1,B,7,What is a bridge-to-bridge station?,An internal communications system linking the wheel house with the ship's primary radio operating position and other integral ship control points.,An inland waterways and coastal radio station serving ship stations operating within the United States.,A portable ship station necessary to eliminate frequent application to operate a ship station on board different vessels.,A VHF radio station located on a ship's navigational bridge or main control station that is used only for navigational communications.,D,00,1-7B3,E1,B,7,When may a bridge-to-bridge transmission be more than 1 watt?,When broadcasting a distress message and rounding a bend in a river or traveling in a blind spot.,When broadcasting a distress message.,When rounding a bend in a river or traveling in a blind spot.,When calling the Coast Guard.,A,00,1-7B4,E1,B,7,When is it legal to transmit high power on Channel 13?,Failure of vessel being called to respond.,In a blind situation such as rounding a bend in a river.,During an emergency.,All of these.,D,00,1-7B5,E1,B,7,A ship station using VHF bridge-to-bridge Channel 13:,May be identified by the name of the ship in lieu of call sign.,May be identified by call sign and country of origin.,Must be identified by call sign and name of vessel.,Does not need to identify itself within 100 miles from shore.,A,00,1-7B6,E1,B,7,The primary purpose of bridge-to-bridge communications is:,Search and rescue emergency calls only.,All short-range transmission aboard ship.,Navigational communications.,Transmission of Captain's orders from the bridge.,C,00,1-8B1,E1,B,8,What is the best way for a radio operator to minimize or prevent interference to other stations?,By using an omni-directional antenna pointed away from other stations.,Reducing power to a level that will not affect other on-frequency communications.,Determine that a frequency is not in use by monitoring the frequency before transmitting.,By changing frequency when notified that a radiocommunication causes interference.,C,00,1-8B2,E1,B,8,Under what circumstances may a coast station using telephony transmit a general call to a group of vessels?,Under no circumstances.,"When announcing or preceding the transmission of Distress, Urgency, Safety or other important messages.",When the vessels are located in international waters beyond 12 miles.,When identical traffic is destined for multiple mobile stations within range.,B,00,1-8B3,E1,B,8,Who determines when a ship station may transmit routine traffic destined for a coast or government station in the maritime mobile service?,Shipboard radio officers may transmit traffic when it will not interfere with ongoing radiocommunications.,The order and time of transmission and permissible type of message traffic is decided by the licensed on-duty operator.,Ship stations must comply with instructions given by the coast or government station.,The precedence of conventional radiocommunications is determined by FCC and international regulation.,C,00,1-8B4,E1,B,8,What is required of a ship station which has established initial contact with another station on 2182 kHz or Ch-16?,The stations must change to an authorized working frequency for the transmission of messages.,"The stations must check the radio channel for Distress, Urgency and Safety calls at least once every ten minutes.",Radiated power must be minimized so as not to interfere with other stations needing to use the channel.,"To expedite safety communications, the vessels must observe radio silence for two out of every fifteen minutes.",A,00,1-8B5,E1,B,8,How does a coast station notify a ship that it has a message for the ship?,By making a directed transmission on 2182 kHz or 156.800 MHz.,The coast station changes to the vessel's known working frequency.,By establishing communications using the eight-digit maritime mobile service identification.,"The coast station may transmit, at intervals, lists of call signs in alphabetical order for which they have traffic.",D,00,1-8B6,E1,B,8,What is the priority of communications?,"Safety, Distress, Urgency and radio direction-finding.","Distress, Urgency and Safety.","Distress, Safety, radio direction-finding, search and rescue.","Radio direction-finding, Distress and Safety.",B,00,1-9B1,E1,B,9,Under what circumstances may a ship or aircraft station interfere with a public coast station?,In cases of distress.,Under no circumstances during on-going radiocommunications.,During periods of government priority traffic handling.,When it is necessary to transmit a message concerning the safety of navigation or important meteorological warnings.,A,00,1-9B2,E1,B,9,"Ordinarily, how often would a station using a telephony emission identify?",At least every 10 minutes.,At the beginning and end of each transmission and at 15-minute intervals.,"At 15-minute intervals, unless public correspondence is in progress.",At 20-minute intervals.,B,00,1-9B3,E1,B,9,When using a SSB station on 2182 kHz or VHF-FM on channel 16:,Preliminary call must not exceed 30 seconds.,"If contact is not made, you must wait at least 2 minutes before repeating the call.","Once contact is established, you must switch to a working frequency.",All of these.,D,00,1-9B4,E1,B,9,What should a station operator do before making a transmission?,"Except for the transmission of distress calls, determine that the frequency is not in use by monitoring the frequency before transmitting.",Transmit a general notification that the operator wishes to utilize the channel.,Check transmitting equipment to be certain it is properly calibrated.,Ask if the frequency is in use.,A,00,1-9B5,E1,B,9,On what frequency should a ship station normally call a coast station when using a radiotelephony emission?,On a vacant radio channel determined by the licensed radio officer.,Calls should be initiated on the appropriate ship-to-shore working frequency of the coast station.,On any calling frequency internationally approved for use within ITU Region 2.,On 2182 kHz or Ch-16 at any time.,B,00,1-9B6,E1,B,9,"In the International Phonetic Alphabet, the letters E, M, and S are represented by the words:","Echo, Michigan, Sonar.","Equator, Mike, Sonar.","Echo, Mike, Sierra","Element, Mister, Scooter",C,00,1-10B1,E1,B,10,What information must be included in a Distress message?,Name of vessel.,Location.,Type of distress and specifics of help requested.,All of the above.,D,00,1-10B2,E1,B,10,What are the highest priority communications from ships at sea?,All critical message traffic authorized by the ship's master.,Navigation and meteorological warnings.,Distress calls are highest and then communications preceded by Urgency and then Safety signals.,Authorized government communications for which priority right has been claimed.,C,00,1-10B3,E1,B,10,What is a Distress communication?,Communications indicating that the calling station has a very urgent message concerning safety.,An internationally recognized communication indicating that the sender is threatened by grave and imminent danger and requests immediate assistance.,"Radio communications which, if delayed, will adversely affect the safety of life or property.",An official radio communication notification of approaching navigational or meteorological hazards.,B,00,1-10B4,E1,B,10,What is the order of priority of radiotelephone communications in the maritime services?,Alarm and health and welfare communications.,"Navigation hazards, meteorological warnings, priority traffic.","Distress calls and signals, followed by communications preceded by Urgency and Safety signals and all other communications.","Government precedence, messages concerning safety of life and protection of property, and traffic concerning grave and imminent danger.",C,00,1-10B5,E1,B,10,The radiotelephone Distress call and message consists of:,"MAYDAY spoken three times, followed by the name of the vessel and the call sign in phonetics spoken three times.","Particulars of its position, latitude and longitude, and other information which might facilitate rescue, such as length, color and type of vessel, and number of persons on board.",Nature of distress and kind of assistance required.,All of the above.,D,00,1-10B6,E1,B,10,What is Distress traffic?,"All messages relative to the immediate assistance required by a ship, aircraft or other vehicle threatened by grave or imminent danger, such as life and safety of persons on board, or man overboard.","In radiotelephony, the speaking of the word, ""Mayday.""",Health and welfare messages concerning property and the safety of a vessel.,Internationally recognized communications relating to important situations.,A,00,1-11B1,E1,B,11,What is a typical Urgency transmission?,A request for medical assistance that does not rise to the level of a Distress or a critical weather transmission higher than Safety.,A radio Distress transmission affecting the security of humans or property.,Health and welfare traffic which impacts the protection of on-board personnel.,A communications alert that important personal messages must be transmitted.,A,00,1-11B2,E1,B,11,What is the internationally recognized Urgency signal?,"The letters ""TTT"" transmitted three times by radiotelegraphy.","The words ""PAN PAN"" spoken three times before the Urgency call.","Three oral repetitions of the word ""Safety"" sent before the call.","The pronouncement of the word ""Mayday.""",B,00,1-11B3,E1,B,11,What is a Safety transmission?,A communications transmission which indicates that a station is preparing to transmit an important navigation or weather warning.,"A radiotelephony warning preceded by the words ""PAN PAN.""",Health and welfare traffic concerning the protection of human life.,"A voice call proceeded by the words ""Safety Alert.""",A,00,1-11B4,E1,B,11,"The Urgency signal concerning the safety of a ship, aircraft or person shall be sent only on the authority of:",Master of ship.,Person responsible for mobile station.,Either Master of ship or person responsible for mobile station.,An FCC-licensed operator.,C,00,1-11B5,E1,B,11,The Urgency signal has lower priority than:,Ship-to-ship routine calls.,Distress.,Safety.,Security.,B,00,1-11B6,E1,B,11,"What safety signal call word is spoken three times, followed by the station call letters spoken three times, to announce a storm warning, danger to navigation, or special aid to navigation?",PAN PAN.,MAYDAY.,SAFETY.,SECURITE.,D,00,1-12B1,E1,B,12,What is the fundamental concept of the GMDSS?,It is intended to automate and improve existing digital selective calling procedures and techniques.,It is intended to provide more effective but lower cost commercial communications.,It is intended to provide compulsory vessels with a collision avoidance system when they are operating in waters that are also occupied by non-compulsory vessels.,It is intended to automate and improve emergency communications in the maritime industry.,D,00,1-12B2,E1,B,12,The primary purpose of the GMDSS is to:,Allow more effective control of SAR situations by vessels.,Provide additional shipboard systems for more effective company communications.,Automate and improve emergency communications for the world's shipping industry.,Provide effective and inexpensive communications.,C,00,1-12B3,E1,B,12,What is the basic concept of GMDSS?,Shoreside authorities and vessels can assist in a coordinated SAR operation with minimum delay.,Search and rescue authorities ashore can be alerted to a Distress situation.,Shipping in the immediate vicinity of a ship in Distress will be rapidly alerted.,All of these.,D,00,1-12B4,E1,B,12,GMDSS is primarily a system based on?,Ship-to-ship Distress communications using MF or HF radiotelephony.,VHF digital selective calling from ship to shore.,"Distress, Urgency and Safety communications carried out by the use of narrow-band direct printing telegraphy.",The linking of search and rescue authorities ashore with shipping in the immediate vicinity of a ship in Distress or in need of assistance.,D,00,1-12B5,E1,B,12,What is the responsibility of vessels under GMDSS?,Vessels over 300 gross tons may be required to render assistance if such assistance does not adversely affect their port schedule.,"Only that vessel, regardless of size, closest to a vessel in Distress, is required to render assistance.",Every ship is able to perform those communications functions that are essential for the Safety of the ship itself and of other ships.,"Vessels operating under GMDSS, outside of areas effectively serviced by shoreside authorities, operating in sea areas A2, and A4 may be required to render assistance in Distress situations.",C,0