0,1-12B6,E1,B,12,GMDSS is required for which of the following?,All vessels capable of international voyages.,SOLAS Convention ships of 300 gross tonnage or more.,Vessels operating outside of the range of VHF coastal radio stations.,Coastal vessels of less than 300 gross tons.,B,00,1-13C1,E1,C,13,What is the purpose of the INT-USA control settings on a VHF?,To change all VTS frequencies to Duplex so all vessels can receive maneuvering orders.,To change all VHF channels from Duplex to Simplex while in U.S. waters.,To change certain International Duplex channel assignments to simplex in the U.S. for VTS and other purposes.,To change to NOAA weather channels and receive weather broadcasts while in the U.S.,C,00,1-13C2,E1,C,13,VHF ship station transmitters must have the capability of reducing carrier power to:,1 watt.,10 watts.,25 watts.,50 watts.,A,00,1-13C3,E1,C,13,The Dual Watch (DW) function is used to:,Listen to Ch-70 at the same time while monitoring Ch-16.,Sequentially monitor 4 different channels.,Sequentially monitoring all VHF channels.,Listen on any selected channel while periodically monitoring Ch-16.,D,00,1-13C4,E1,C,13,Which of the following statements best describes the correct setting for manual adjustment of the squelch control?,Adjust squelch control to the minimum level necessary to barely suppress any background noise.,Always adjust squelch control to its maximum level.,Always adjust squelch control to its minimum level.,Adjust squelch control to approximately twice the minimum level necessary to barely suppress any background noise.,A,00,1-13C5,E1,C,13,"The ""Scan"" function is used to:",Monitor  Ch-16 continuously and switching to either Ch-70 or Ch-13 every 5 seconds.,Scan Ch-16 for Distress calls.,Scan Ch-70 for Distress alerts.,Sequentially scan all or selected channels.,D,00,1-13C6,E1,C,13,"Why must all VHF Distress, Urgency and Safety communications (as well as VTS traffic calls) be performed in Simplex operating mode?",To minimize interference from vessels engaged in routine communications.,To ensure that vessels not directly participating in the communications can hear both sides of the radio exchange.,To enable an RCC or Coast station to only hear communications from the vessel actually in distress.,To allow an RCC or Coast station to determine which transmissions are from other vessels and which transmissions are from the vessel actually in distress.,B,00,1-14C1,E1,C,14,What channel must VHF-FM-equipped vessels monitor at all times when the vessel is at sea?,Channel 8.,Channel 16.,Channel 5A.,Channel 1A.,B,00,1-14C2,E1,C,14,What is the aircraft frequency and emission used for distress communications?,243.000 MHz - F3E.,121.500 MHz - F3E.,156.525 MHz - F1B.,121.500 MHz - A3E.,D,00,1-14C3,E1,C,14,Which VHF channel is used only for digital selective calling?,Channel 70.,Channel 16.,Channel 22A.,Channel 6.,A,00,1-14C4,E1,C,14,Which channel is utilized for the required bridge-to-bridge watch?,DSC on Ch-70.,VHF-FM on Ch-16.,VHF-FM on Ch-13 in most areas of the continental United States.,The vessel's VHF working frequency.,C,00,1-14C5,E1,C,14,Which channel would most likely be used for routine ship-to-ship voice traffic?,Ch-16.,Ch-08.,Ch-70.,Ch-22A.,B,00,1-14C6,E1,C,14,What channel would you use to place a call to a shore telephone?,Ch-16.,Ch-70.,Ch-28.,Ch-06.,C,00,1-15C1,E1,C,15,Which modes could be selected to receive vessel traffic lists from high seas shore stations?,AM and VHF-FM.,ARQ and FEC.,VHF-FM and SSB.,SSB and FEC.,D,00,1-15C2,E1,C,15,"Why must all MF-HF Distress, Urgency and Safety communications take place solely on the 6 assigned frequencies and in the simplex operating mode?","For non-GMDSS ships, to maximize the chances for other vessels to receive those communications.",Answers a) and c) are both correct.,"For GMDSS or DSC-equipped ships, to maximize the chances for other vessels to receive those communications following the transmission of a DSC call of the correct priority.",To enable an RCC or Coast station to only hear communications from the vessel actually in distress.,B,00,1-15C3,E1,C,15,"To set-up the MF/HF transceiver for a voice call to a coast station, the operator must:",Select J3E mode for proper SITOR operations.,"Select F1B mode or J2B mode, depending on the equipment manufacturer.",Select J3E mode for proper voice operations.,"Select F1B/J2B modes or J3E mode, depending on whether FEC or ARQ is preferred.",C,00,1-15C4,E1,C,15,MF/HF transceiver power levels should be set:,To the lowest level necessary for effective communications.,To the level necessary to maximize the propagation radius.,"To the highest level possible so as to ensure other stations cannot ""break-in"" on the channel during use.",Both a) and c) are correct.,A,00,1-15C5,E1,C,15,"To set-up the MF/HF transceiver for a TELEX call to a coast station, the operator must:",Select J3E mode for proper SITOR operations.,"Select F1B mode or J2B mode, depending on the equipment manufacturer.","Select F1B/J2B modes or J3E mode, depending on whether ARQ or FEC is preferred.",None of the above.,B,00,1-15C6,E1,C,15,"What is the purpose of the Receiver Incremental Tuning (RIT) or ""Clarifier"" control?","It acts as a ""fine-tune"" control on the receive frequency.","It acts as a ""fine-tune"" control on the transmitted frequency.","It acts as a ""fine-tune"" control on both the receive and transmitted frequencies.",None of the above.,A,00,1-16C1,E1,C,16,On what frequency would a vessel normally call another ship station when using a radiotelephony emission?,Only on 2182 kHz in ITU Region 2.,"On 2182 kHz or Ch-16, unless the station knows that the called vessel maintains a simultaneous watch on another intership working frequency.",On the appropriate calling channel of the ship station at 15 minutes past the hour.,On the vessel's unique working radio channel assigned by the Federal Communications Commission.,B,00,1-16C2,E1,C,16,What is the MF radiotelephony calling and Distress frequency?,2670 kHz.,Ch-06 VHF.,2182 kHz.,Ch-22 VHF.,C,00,1-16C3,E1,C,16,"For general communications purposes, paired frequencies are:",Normally used with private coast stations.,Normally used between ship stations.,Normally used between private coast and ship stations.,Normally used with public coast stations.,D,00,1-16C4,E1,C,16,What emission must be used when operating on the MF distress and calling voice frequency?,J3E - Single sideband telephony.,A1A - On-off keying without modulation by an audio frequency.,F3E - Frequency modulation telephony.,"A3E - Amplitude modulation telephony, double sideband.",A,00,1-16C5,E1,C,16,"Which of the following defines high frequency ""ITU Channel 1212""?",Ch-12 in the 16 MHz band.,Ch-1216 in the MF band.,The 12th channel in the 12 MHz band.,This would indicate the 1st channel in the 12 MHz band.,C,00,1-16C6,E1,C,16,"For general communications purposes, simplex frequencies are:",Normally used between ship stations and private coast stations.,Normally used with public coast stations.,Normally used between ship stations.,Both a) and c) are correct.,D,00,1-17C1,E1,C,17,What is the proper procedure for testing a radiotelephone installation?,A dummy antenna must be used to insure the test will not interfere with ongoing communications.,"Transmit the station's call sign, followed by the word ""test"" on the frequency being used for the test.",Permission for the voice test must be requested and received from the nearest public coast station.,Short tests must be confined to a single frequency and must never be conducted in port.,B,00,1-17C2,E1,C,17,"When testing is conducted on 2182 kHz or Ch-16, testing should not continue for more than ______ in any 5-minute period.",2 minutes.,1 minute.,30 seconds.,10 seconds.,D,00,1-17C3,E1,C,17,"Under GMDSS, a compulsory VHF-DSC radiotelephone installation must be tested at what minimum intervals at sea?",Daily.,"Annually, by a representative of the FCC.",Weekly.,Monthly.,A,00,1-17C4,E1,C,17,The best way to test the MF-HF NBDP system is?,Make a radiotelephone call to a coast station.,Initiate an ARQ call to demonstrate that the transmitter and antenna are working.,Initiate an FEC call to demonstrate that the transmitter and antenna are working.,Initiate an ARQ call to a Coast Station and wait for the automatic exchange of answerbacks.,D,00,1-17C5,E1,C,17,The best way to test the Inmarsat-C terminal is?,Compose and send a brief message to your own Inmarsat-C terminal.,Send a message to a shore terminal and wait for confirmation.,Send a message to another ship terminal.,"If the ""Send"" light flashes, proper operation has been confirmed.",A,00,1-17C6,E1,C,17,When may you test a radiotelephone transmitter on the air?,Between midnight and 6:00 AM local time.,Only when authorized by the Commission.,At any time (except during silent periods) as necessary to assure proper operation.,After reducing transmitter power to 1 watt.,C,00,1-18C1,E1,C,18,"Under normal circumstances, what do you do if the transmitter aboard your ship is operating off-frequency, overmodulating or distorting?",Reduce to low power.,Reduce audio volume level.,Stop transmitting.,Make a notation in station operating log.,C,00,1-18C2,E1,C,18,Which would be an indication of proper operation of a SSB transmitter rated at 60 watt PEP output?,"In SSB (J3E) voice mode, with the transmitter keyed but without speaking into the microphone, power output is indicated.","In SITOR communications, the power meter can be seen fluctuating regularly from zero to the 60 watt relative output reading.","In SSB (J3E) mode, speaking into the microphone causes power meter to fluctuate slightly around the 60 watt reading.",A steady indication of transmitted energy on an RF Power meter with no fluctuations when speaking into the microphone.,B,00,1-18C3,E1,C,18,If a ship radio transmitter signal becomes distorted:,Reduce transmitter power.,Use minimum modulation.,Cease operations.,Reduce audio amplitude.,C,00,1-18C4,E1,C,18,What would be an indication of a malfunction on a GMDSS station with a 24 VDC battery system?,A constant 30 volt reading on the GMDSS console voltmeter.,"After testing the station on battery power, the ammeter reading indicates a high rate of charge that then declines. ","After testing the station on battery power, a voltmeter reading of 30 volts for brief period followed by a steady 26 volt reading.",None of the above.,A,00,1-18C5,E1,C,18,Your antenna tuner becomes totally inoperative. What would you do to obtain operation on both the 8 MHz and 22 MHz frequency bands?,"Without an operating antenna tuner, transmission is impossible.","It is impossible to obtain operation on 2 different HF bands, without an operating antenna tuner.",Bypass the antenna tuner and shorten the whip to 15 ft.,Bypass the antenna tuner. Use a straight whip or wire antenna approximately 30 ft long.,D,00,1-18C6,E1,C,18,"Which of the following conditions would be a symptom of malfunction in a 2182 kHz radiotelephone system that must be reported to the Master, then logged appropriately.",Much higher noise level observed during daytime operation.,No indication of power output when speaking into the microphone.,"When testing a radiotelephone alarm on 2182 kHz into an artificial antenna, the Distress frequency watch receiver becomes unmuted, an improper testing procedure.",Failure to contact a shore station 600 nautical miles distant during daytime operation.,B,00,1-19D1,E1,D,19,"What are the antenna requirements of a VHF telephony coast, maritime utility or ship station?",The shore or on-board antenna must be vertically polarized.,The antenna array must be type-accepted for 30-200 MHz operation by the FCC.,The horizontally-polarized antenna must be positioned so as not to cause excessive interference to other stations.,The antenna must be capable of being energized by an output in excess of 100 watts.,A,00,1-19D2,E1,D,19,What is the antenna requirement of a radiotelephone installation aboard a passenger vessel?,The antenna must be located a minimum of 15 meters from the radiotelegraph antenna.,The antenna must be vertically polarized and as non-directional and efficient as is practicable for the transmission and reception of ground waves over seawater.,An emergency reserve antenna system must be provided for communications on 156.800 MHz.,All antennas must be tested and the operational results logged at least once during each voyage.,B,00,1-19D3,E1,D,19,What is the most common type of antenna for GMDSS VHF?,Horizontally polarized circular antenna.,Long wire antenna.,Both of the above.,None of the above.,D,00,1-19D4,E1,D,19,What is the purpose of the antenna tuner?,It alters the electrical characteristics of the antenna to match the frequency in use.,It physically alters the length of the antenna to match the frequency in use.,It makes the antenna look like a half-wave antenna at the frequency in use.,None of the above.,A,00,1-19D5,E1,D,19,What advantage does a vertical whip have over a long wire?,It radiates more signal fore and aft.,It radiates equally well in all directions.,It radiates a strong signal vertically.,None of the above.,B,00,1-19D6,E1,D,19,A vertical whip antenna has a radiation pattern best described by?,A figure eight.,A cardioid.,A circle.,An ellipse.,C,00,1-20D1,E1,D,20,"For a small passenger vessel inspection, reserve power batteries must be tested:",At intervals not exceeding every 3 months.,At intervals not exceeding every 6 months,Before any new voyage,"At intervals not exceeding 12 months, or during the inspection.",D,00,1-20D2,E1,D,20,What are the characteristics of the Reserve Source of Energy under GMDSS?,Supplies independent HF and MF installations at the same time.,Cannot be independent of the propelling power of the ship.,Must be independent of the ship's electrical system when the RSE is needed to supply power to the GMDSS equipment.,Must be incorporated into the ship's electrical system.,C,00,1-20D3,E1,D,20,Which of the following terms is defined as a back-up power source that provides power to radio installations for the purpose of conducting Distress and Safety communications when the vessel's main and emergency generators cannot?,Emergency Diesel Generator.,Reserve Source of Energy.,Reserve Source of Diesel Power.,Emergency Back-up Generator.,B,00,1-20D4,E1,D,20,"In the event of failure of the main and emergency sources of electrical power, what is the term for the source required to supply the GMDSS console with power for conducting distress and other radio communications?",Emergency power.,Ship's emergency diesel generator.,Reserve source of energy.,Ship's standby generator,C,00,1-20D5,E1,D,20,What is the requirement for emergency and reserve power in GMDSS radio installations?,An emergency power source for radio communications is not required if a vessel has proper reserve power (batteries).,A reserve power source is not required for radio communications.,Only one of the above is required if a vessel is equipped with a second 406 EPIRB as a backup means of sending a distress alert.,All newly constructed ships under GMDSS must have both emergency and reserve power sources for radio communications.,D,00,1-20D6,E1,D,20,"What is the meaning of ""Reserve Source of Energy""?",The supply of electrical energy sufficient to operate the radio installations for the purpose of conducting Distress and Safety communications in the event of failure of the ship's main and emergency sources of electrical power.,"High caloric value items for lifeboat, per SOLAS regulations.",Diesel fuel stored for the purpose of operating the powered survival craft for a period equal to or exceeding the U.S.C.G. and SOLAS requirements.,None of these.,A,00,1-21D1,E1,D,21,What is an EPIRB?,A battery-operated emergency position-indicating radio beacon that floats free of a sinking ship.,An alerting device notifying mariners of imminent danger.,A satellite-based maritime distress and safety alerting system.,A high-efficiency audio amplifier.,A,00,1-21D2,E1,D,21,When are EPIRB batteries changed?,After emergency use; after battery life expires.,After emergency use or within the month and year replacement date printed on the EPIRB.,After emergency use; every 12 months when not used.,Whenever voltage drops to less than 20% of full charge.,B,00,1-21D3,E1,D,21,"If a ship sinks, what device is designed to float free of the mother ship, is turned on automatically and transmits a distress signal?",An emergency position indicating radio beacon.,EPIRB on 2182 kHz and 405.025 kHz.,Bridge-to-bridge transmitter on 2182 kHz.,Auto alarm keyer on any frequency.,A,00,1-21D4,E1,D,21,How do you cancel a false EPIRB distress alert?,Transmit a DSC distress alert cancellation.,"Transmit a broadcast message to ""all stations"" canceling the distress message.",Notify the Coast Guard or rescue coordination center at once.,"Make a radiotelephony ""distress cancellation"" transmission on 2182 kHz.",C,00,1-21D5,E1,D,21,What is the COSPAS-SARSAT system?,"A global satellite communications system for users in the maritime, land and aeronautical mobile services.",An international satellite-based search and rescue system.,A broadband military satellite communications network.,A Wide Area Geostationary Satellite program (WAGS).,B,00,1-21D6,E1,D,21,What is an advantage of a 406 MHz satellite EPIRB?,It is compatible with the COSPAS-SARSAT Satellites and Global Maritime Distress  Safety System (GMDSS) regulations.,"Provides a fast, accurate method for  the Coast Guard to locating and rescuing persons in distress.",Includes a digitally encoded message containing the ship's identity and nationality.,All of the above.,D,00,1-22D1,E1,D,22,In which frequency band does a search and rescue transponder operate?,3 GHz.,S-band.,406 MHz.,9 GHz.,D,00,1-22D2,E1,D,22,How should the signal from a Search And Rescue Radar Transponder appear on a RADAR display?,A series of dashes.,A series of spirals all originating from the range and bearing of the SART.,A series of 12 equally spaced dots.,A series of twenty dashes.,C,00,1-22D3,E1,D,22,What is the purpose of the SART's audible tone alarm?,It informs survivors that assistance may be nearby.,It informs survivors when the battery's charge condition has weakened.,"It informs survivors when the SART switches to the ""standby"" mode.",It informs survivors that a nearby vessel is signaling on DSC.,A,00,1-22D4,E1,D,22,Which statement is true regarding the SART?,This is a performance monitor attached to at least one S-band navigational RADAR system.,This is a 9 GHz transponder capable of being received by another vessel's S-band navigational RADAR system.,This is a performance monitor attached to at least one X-band navigational RADAR system.,This is a 9 GHz transponder capable of being received by vessel's X-band navigational RADAR system.,D,00,1-22D5,E1,D,22,At what point does a SART begin transmitting?,"It immediately begins radiating when placed in the ""on"" position.",It must be manually activated.,"If it has been placed in the ""on"" position, it will respond when it has been interrogated by a 9-GHz RADAR signal.","If it has been placed in the ""on"" position, it will begin transmitting immediately upon detecting that it is in water.",C,00,1-22D6,E1,D,22,How can a SART's effective range be maximized?,The SART should be placed in water immediately upon activation.,The SART should be held as high as possible.,"Switch the SART into the ""high"" power position.","If possible, the SART should be mounted horizontally so that its signal matches that of the searching RADAR signal.",B,00,1-23D1,E1,D,23,Which statement is NOT true regarding the requirements of survival craft portable two-way VHF radiotelephone equipment?,Watertight to a depth of 1 meter for 5 minutes.,Effective radiated power should be a minimum of 0.25 watts.,Operates simplex on Ch-70 and at least one other channel.,The antenna is fixed and non-removable.,C,00,1-23D2,E1,D,23,Which statement is NOT true regarding the requirements of survival craft portable two-way VHF radiotelephone equipment?,Operation on Ch-13.,Effective radiated power should be a minimum of 0.25 Watts.,Simplex voice communications only.,Operation on Ch-16.,A,00,1-23D3,E1,D,23,With what other stations may portable survival craft transceivers communicate?,Communication is permitted between survival craft.,Communication is permitted between survival craft and ship.,Communication is permitted between survival craft and rescue unit.,All of the above.,D,00,1-23D4,E1,D,23,Equipment for radiotelephony use in survival craft stations under GMDSS must have what capability?,Operation on Ch-16.,Operation on 457.525 MHz.,Operation on 121.5 MHz.,Any one of these.,A,00,1-23D5,E1,D,23,Equipment for radiotelephony use in survival craft stations under GMDSS must have what characteristic(s)?,Operation on Ch-16.,Watertight.,Permanently-affixed antenna.,All of these.,D,00,1-23D6,E1,D,23,What is the minimum power of the SCT,Five watts.,One watt.,1/4 watt.,None of the above.,B,00,1-24D1,E1,D,24,NAVTEX broadcasts are sent:,Immediately following traffic lists.,In categories of messages indicated by a single letter or identifier.,On request of maritime mobile stations.,"Regularly, after the radiotelephone silent periods.",B,00,1-24D2,E1,D,24,MSI can be obtained by one (or more) of the following:,NAVTEX.,SafetyNET.,HF NBDP.,All of the above.,D,00,1-24D3,E1,D,24,Which of the following is the primary frequency that is used exclusively for NAVTEX broadcasts internationally?,518 kHz.,2187.5 kHz.,4209.5 kHz.,"VHF channel 16 when the vessel is sailing in Sea Area A1, and 2187.5 kHz when in Sea Area A2.",A,00,1-24D4,E1,D,24,What means are used to prevent the reception of unwanted broadcasts by vessels utilizing the NAVTEX system?,Operating the receiver only during daytime hours.,Coordinating reception with published broadcast schedules.,Programming the receiver to reject unwanted broadcasts.,Automatic receiver de-sensitization during night hours.,C,00,1-24D5,E1,D,24,When do NAVTEX broadcasts typically achieve maximum transmitting range?,Local noontime.,Middle of the night.,Sunset.,Post sunrise.,B,00,1-24D6,E1,D,24,What is the transmitting range of most NAVTEX stations?,Typically 50-100 nautical miles (90-180 km) from shore.,Typically upwards of 1000 nautical miles (1800 km) during the daytime.,Typically 200-400 nautical miles (360-720 km).,It is limited to line-of-sight or about 30 nautical miles (54 km).,C,0